title,authors,abstract,pdf_url,published,arxiv_id,Title,Model,Rating,Reasoning
Cloud Atlas: Efficient Fault Localization for Cloud Systems using Language Models and Causal Insight,"['Zhiqiang Xie', 'Yujia Zheng', 'Lizi Ottens', 'Kun Zhang', 'Christos Kozyrakis', 'Jonathan Mace']","Runtime failure and performance degradation is commonplace in modern cloud
systems. For cloud providers, automatically determining the root cause of
incidents is paramount to ensuring high reliability and availability as prompt
fault localization can enable faster diagnosis and triage for timely
resolution. A compelling solution explored in recent work is causal reasoning
using causal graphs to capture relationships between varied cloud system
performance metrics. To be effective, however, systems developers must
correctly define the causal graph of their system, which is a time-consuming,
brittle, and challenging task that increases in difficulty for large and
dynamic systems and requires domain expertise. Alternatively, automated
data-driven approaches have limited efficacy for cloud systems due to the
inherent rarity of incidents. In this work, we present Atlas, a novel approach
to automatically synthesizing causal graphs for cloud systems. Atlas leverages
large language models (LLMs) to generate causal graphs using system
documentation, telemetry, and deployment feedback. Atlas is complementary to
data-driven causal discovery techniques, and we further enhance Atlas with a
data-driven validation step. We evaluate Atlas across a range of fault
localization scenarios and demonstrate that Atlas is capable of generating
causal graphs in a scalable and generalizable manner, with performance that far
surpasses that of data-driven algorithms and is commensurate to the
ground-truth baseline.",http://arxiv.org/pdf/2407.08694v1,2024-07-11,2407.08694v1,Cloud Atlas: Efficient Fault Localization for Cloud Systems using Language Models and Causal Insight,gpt-4,highly irrelevant,"The paper is about using large language models (LLMs) for facilitating fault localization in cloud systems, not about the concept of hard prefix prompting or prompt engineering in transformers."
ElasticAST: An Audio Spectrogram Transformer for All Length and Resolutions,"['Jiu Feng', 'Mehmet Hamza Erol', 'Joon Son Chung', 'Arda Senocak']","Transformers have rapidly overtaken CNN-based architectures as the new
standard in audio classification. Transformer-based models, such as the Audio
Spectrogram Transformers (AST), also inherit the fixed-size input paradigm from
CNNs. However, this leads to performance degradation for ASTs in the inference
when input lengths vary from the training. This paper introduces an approach
that enables the use of variable-length audio inputs with AST models during
both training and inference. By employing sequence packing, our method
ElasticAST, accommodates any audio length during training, thereby offering
flexibility across all lengths and resolutions at the inference. This
flexibility allows ElasticAST to maintain evaluation capabilities at various
lengths or resolutions and achieve similar performance to standard ASTs trained
at specific lengths or resolutions. Moreover, experiments demonstrate
ElasticAST's better performance when trained and evaluated on native-length
audio datasets.",http://arxiv.org/pdf/2407.08691v1,2024-07-11,2407.08691v1,ElasticAST: An Audio Spectrogram Transformer for All Length and Resolutions,gpt-4,highly irrelevant,"The paper focuses on audio classification using Transformer-based models, in particular dealing with variable-length audio inputs, and does not mention or imply anything about prompts or prompt engineering."
"Operationalizing the Blueprint for an AI Bill of Rights: Recommendations for Practitioners, Researchers, and Policy Makers","['Alex Oesterling', 'Usha Bhalla', 'Suresh Venkatasubramanian', 'Himabindu Lakkaraju']","As Artificial Intelligence (AI) tools are increasingly employed in diverse
real-world applications, there has been significant interest in regulating
these tools. To this end, several regulatory frameworks have been introduced by
different countries worldwide. For example, the European Union recently passed
the AI Act, the White House issued an Executive Order on safe, secure, and
trustworthy AI, and the White House Office of Science and Technology Policy
issued the Blueprint for an AI Bill of Rights (AI BoR). Many of these
frameworks emphasize the need for auditing and improving the trustworthiness of
AI tools, underscoring the importance of safety, privacy, explainability,
fairness, and human fallback options. Although these regulatory frameworks
highlight the necessity of enforcement, practitioners often lack detailed
guidance on implementing them. Furthermore, the extensive research on
operationalizing each of these aspects is frequently buried in technical papers
that are difficult for practitioners to parse. In this write-up, we address
this shortcoming by providing an accessible overview of existing literature
related to operationalizing regulatory principles. We provide
easy-to-understand summaries of state-of-the-art literature and highlight
various gaps that exist between regulatory guidelines and existing AI research,
including the trade-offs that emerge during operationalization. We hope that
this work not only serves as a starting point for practitioners interested in
learning more about operationalizing the regulatory guidelines outlined in the
Blueprint for an AI BoR but also provides researchers with a list of critical
open problems and gaps between regulations and state-of-the-art AI research.
Finally, we note that this is a working paper and we invite feedback in line
with the purpose of this document as described in the introduction.",http://arxiv.org/pdf/2407.08689v1,2024-07-11,2407.08689v1,"Operationalizing the Blueprint for an AI Bill of Rights: Recommendations for Practitioners, Researchers, and Policy Makers",gpt-4,highly irrelevant,"The paper focuses on AI regulation and its impact on trustworthiness, safety, privacy, and fairness, rather than hard prefix prompts or prompt engineering."
Uncertainty Estimation of Large Language Models in Medical Question Answering,"['Jiaxin Wu', 'Yizhou Yu', 'Hong-Yu Zhou']","Large Language Models (LLMs) show promise for natural language generation in
healthcare, but risk hallucinating factually incorrect information. Deploying
LLMs for medical question answering necessitates reliable uncertainty
estimation (UE) methods to detect hallucinations. In this work, we benchmark
popular UE methods with different model sizes on medical question-answering
datasets. Our results show that current approaches generally perform poorly in
this domain, highlighting the challenge of UE for medical applications. We also
observe that larger models tend to yield better results, suggesting a
correlation between model size and the reliability of UE. To address these
challenges, we propose Two-phase Verification, a probability-free Uncertainty
Estimation approach. First, an LLM generates a step-by-step explanation
alongside its initial answer, followed by formulating verification questions to
check the factual claims in the explanation. The model then answers these
questions twice: first independently, and then referencing the explanation.
Inconsistencies between the two sets of answers measure the uncertainty in the
original response. We evaluate our approach on three biomedical
question-answering datasets using Llama 2 Chat models and compare it against
the benchmarked baseline methods. The results show that our Two-phase
Verification method achieves the best overall accuracy and stability across
various datasets and model sizes, and its performance scales as the model size
increases.",http://arxiv.org/pdf/2407.08662v1,2024-07-11,2407.08662v1,Uncertainty Estimation of Large Language Models in Medical Question Answering,gpt-4,highly irrelevant,"This paper focuses on uncertainty estimation in large language models in the context of medical question answering, and though it uses language models for generation and verification, it does not discuss prefix prompts or prompt engineering."
SPOCKMIP: Segmentation of Vessels in MRAs with Enhanced Continuity using Maximum Intensity Projection as Loss,"['Chethan Radhakrishna', 'Karthikesh Varma Chintalapati', 'Sri Chandana Hudukula Ram Kumar', 'Raviteja Sutrave', 'Hendrik Mattern', 'Oliver Speck', 'Andreas Nürnberger', 'Soumick Chatterjee']","Identification of vessel structures of different sizes in biomedical images
is crucial in the diagnosis of many neurodegenerative diseases. However, the
sparsity of good-quality annotations of such images makes the task of vessel
segmentation challenging. Deep learning offers an efficient way to segment
vessels of different sizes by learning their high-level feature representations
and the spatial continuity of such features across dimensions. Semi-supervised
patch-based approaches have been effective in identifying small vessels of one
to two voxels in diameter. This study focuses on improving the segmentation
quality by considering the spatial correlation of the features using the
Maximum Intensity Projection~(MIP) as an additional loss criterion. Two methods
are proposed with the incorporation of MIPs of label segmentation on the
single~(z-axis) and multiple perceivable axes of the 3D volume. The proposed
MIP-based methods produce segmentations with improved vessel continuity, which
is evident in visual examinations of ROIs. Patch-based training is improved by
introducing an additional loss term, MIP loss, to penalise the predicted
discontinuity of vessels. A training set of 14 volumes is selected from the
StudyForrest dataset comprising of 18 7-Tesla 3D Time-of-Flight~(ToF) Magnetic
Resonance Angiography (MRA) images. The generalisation performance of the
method is evaluated using the other unseen volumes in the dataset. It is
observed that the proposed method with multi-axes MIP loss produces better
quality segmentations with a median Dice of $80.245 \pm 0.129$. Also, the
method with single-axis MIP loss produces segmentations with a median Dice of
$79.749 \pm 0.109$. Furthermore, a visual comparison of the ROIs in the
predicted segmentation reveals a significant improvement in the continuity of
the vessels when MIP loss is incorporated into training.",http://arxiv.org/pdf/2407.08655v1,2024-07-11,2407.08655v1,SPOCKMIP: Segmentation of Vessels in MRAs with Enhanced Continuity using Maximum Intensity Projection as Loss,gpt-4,highly irrelevant,This paper is about MIA image segmentation and not about hard prefix prompting or prompt engineering.
Confidence-based Estimators for Predictive Performance in Model Monitoring,"['Juhani Kivimäki', 'Jakub Białek', 'Jukka K. Nurminen', 'Wojtek Kuberski']","After a machine learning model has been deployed into production, its
predictive performance needs to be monitored. Ideally, such monitoring can be
carried out by comparing the model's predictions against ground truth labels.
For this to be possible, the ground truth labels must be available relatively
soon after inference. However, there are many use cases where ground truth
labels are available only after a significant delay, or in the worst case, not
at all. In such cases, directly monitoring the model's predictive performance
is impossible.
  Recently, novel methods for estimating the predictive performance of a model
when ground truth is unavailable have been developed. Many of these methods
leverage model confidence or other uncertainty estimates and are experimentally
compared against a naive baseline method, namely Average Confidence (AC), which
estimates model accuracy as the average of confidence scores for a given set of
predictions. However, until now the theoretical properties of the AC method
have not been properly explored. In this paper, we try to fill this gap by
reviewing the AC method and show that under certain general assumptions, it is
an unbiased and consistent estimator of model accuracy with many desirable
properties. We also compare this baseline estimator against some more complex
estimators empirically and show that in many cases the AC method is able to
beat the others, although the comparative quality of the different estimators
is heavily case-dependent.",http://arxiv.org/pdf/2407.08649v1,2024-07-11,2407.08649v1,Confidence-based Estimators for Predictive Performance in Model Monitoring,gpt-4,highly irrelevant,The paper discusses the estimation of predictive performance in machine learning models and does not mention or allude to the concept of hard prefix prompting or prompt engineering.
Towards Building Specialized Generalist AI with System 1 and System 2 Fusion,"['Kaiyan Zhang', 'Biqing Qi', 'Bowen Zhou']","In this perspective paper, we introduce the concept of Specialized Generalist
Artificial Intelligence (SGAI or simply SGI) as a crucial milestone toward
Artificial General Intelligence (AGI). Compared to directly scaling general
abilities, SGI is defined as AI that specializes in at least one task,
surpassing human experts, while also retaining general abilities. This fusion
path enables SGI to rapidly achieve high-value areas. We categorize SGI into
three stages based on the level of mastery over professional skills and
generality performance. Additionally, we discuss the necessity of SGI in
addressing issues associated with large language models, such as their
insufficient generality, specialized capabilities, uncertainty in innovation,
and practical applications. Furthermore, we propose a conceptual framework for
developing SGI that integrates the strengths of Systems 1 and 2 cognitive
processing. This framework comprises three layers and four key components,
which focus on enhancing individual abilities and facilitating collaborative
evolution. We conclude by summarizing the potential challenges and suggesting
future directions. We hope that the proposed SGI will provide insights into
further research and applications towards achieving AGI.",http://arxiv.org/pdf/2407.08642v1,2024-07-11,2407.08642v1,Towards Building Specialized Generalist AI with System 1 and System 2 Fusion,gpt-4,highly irrelevant,"The abstract of this paper does not mention or allude to the use of hard prefix prompts, prompt engineering, or similar topics."
$β$-DPO: Direct Preference Optimization with Dynamic $β$,"['Junkang Wu', 'Yuexiang Xie', 'Zhengyi Yang', 'Jiancan Wu', 'Jinyang Gao', 'Bolin Ding', 'Xiang Wang', 'Xiangnan He']","Direct Preference Optimization (DPO) has emerged as a compelling approach for
training Large Language Models (LLMs) to adhere to human preferences. However,
the performance of DPO is sensitive to the fine-tuning of its trade-off
parameter $\beta$, as well as to the quality of the preference data. We analyze
the impact of $\beta$ and data quality on DPO, uncovering that optimal $\beta$
values vary with the informativeness of pairwise data. Addressing the
limitations of static $\beta$ values, we introduce a novel framework that
dynamically calibrates $\beta$ at the batch level, informed by data quality
considerations. Additionally, our method incorporates $\beta$-guided data
filtering to safeguard against the influence of outliers. Through empirical
evaluation, we demonstrate that our dynamic $\beta$ adjustment technique
significantly improves DPO's performance across a range of models and datasets,
offering a more robust and adaptable training paradigm for aligning LLMs with
human feedback. The code is available at
\url{https://github.com/junkangwu/beta-DPO}.",http://arxiv.org/pdf/2407.08639v1,2024-07-11,2407.08639v1,$β$-DPO: Direct Preference Optimization with Dynamic $β$,gpt-4,highly irrelevant,"The paper is about direct preference optimization, a method for training large language models to align with human feedback, and not related to prompting or prompt engineering."
A Novel Framework for Automated Warehouse Layout Generation,"['Atefeh Shahroudnejad', 'Payam Mousavi', 'Oleksii Perepelytsia', 'Sahir', 'David Staszak', 'Matthew E. Taylor', 'Brent Bawel']","Optimizing warehouse layouts is crucial due to its significant impact on
efficiency and productivity. We present an AI-driven framework for automated
warehouse layout generation. This framework employs constrained beam search to
derive optimal layouts within given spatial parameters, adhering to all
functional requirements. The feasibility of the generated layouts is verified
based on criteria such as item accessibility, required minimum clearances, and
aisle connectivity. A scoring function is then used to evaluate the feasible
layouts considering the number of storage locations, access points, and
accessibility costs. We demonstrate our method's ability to produce feasible,
optimal layouts for a variety of warehouse dimensions and shapes, diverse door
placements, and interconnections. This approach, currently being prepared for
deployment, will enable human designers to rapidly explore and confirm options,
facilitating the selection of the most appropriate layout for their use-case.",http://arxiv.org/pdf/2407.08633v1,2024-07-11,2407.08633v1,A Novel Framework for Automated Warehouse Layout Generation,gpt-4,highly irrelevant,"The paper is centered around the optimization of warehouse layouts using an AI framework, and does not discuss or mention prompt engineering or hard prefix prompting techniques."
Tamil Language Computing: the Present and the Future,['Kengatharaiyer Sarveswaran'],"This paper delves into the text processing aspects of Language Computing,
which enables computers to understand, interpret, and generate human language.
Focusing on tasks such as speech recognition, machine translation, sentiment
analysis, text summarization, and language modelling, language computing
integrates disciplines including linguistics, computer science, and cognitive
psychology to create meaningful human-computer interactions. Recent
advancements in deep learning have made computers more accessible and capable
of independent learning and adaptation. In examining the landscape of language
computing, the paper emphasises foundational work like encoding, where Tamil
transitioned from ASCII to Unicode, enhancing digital communication. It
discusses the development of computational resources, including raw data,
dictionaries, glossaries, annotated data, and computational grammars, necessary
for effective language processing. The challenges of linguistic annotation, the
creation of treebanks, and the training of large language models are also
covered, emphasising the need for high-quality, annotated data and advanced
language models. The paper underscores the importance of building practical
applications for languages like Tamil to address everyday communication needs,
highlighting gaps in current technology. It calls for increased research
collaboration, digitization of historical texts, and fostering digital usage to
ensure the comprehensive development of Tamil language processing, ultimately
enhancing global communication and access to digital services.",http://arxiv.org/pdf/2407.08618v1,2024-07-11,2407.08618v1,Tamil Language Computing: the Present and the Future,gpt-4,highly irrelevant,"This paper focuses on the broader field of language computing, including language modeling, speech recognition, translation, and other tasks. It does not discuss hard prefix prompting or prompt engineering specifically."
FlashAttention-3: Fast and Accurate Attention with Asynchrony and Low-precision,"['Jay Shah', 'Ganesh Bikshandi', 'Ying Zhang', 'Vijay Thakkar', 'Pradeep Ramani', 'Tri Dao']","Attention, as a core layer of the ubiquitous Transformer architecture, is the
bottleneck for large language models and long-context applications.
FlashAttention elaborated an approach to speed up attention on GPUs through
minimizing memory reads/writes. However, it has yet to take advantage of new
capabilities present in recent hardware, with FlashAttention-2 achieving only
35% utilization on the H100 GPU. We develop three main techniques to speed up
attention on Hopper GPUs: exploiting asynchrony of the Tensor Cores and TMA to
(1) overlap overall computation and data movement via warp-specialization and
(2) interleave block-wise matmul and softmax operations, and (3) block
quantization and incoherent processing that leverages hardware support for FP8
low-precision. We demonstrate that our method, FlashAttention-3, achieves
speedup on H100 GPUs by 1.5-2.0$\times$ with FP16 reaching up to 740 TFLOPs/s
(75% utilization), and with FP8 reaching close to 1.2 PFLOPs/s. We validate
that FP8 FlashAttention-3 achieves 2.6$\times$ lower numerical error than a
baseline FP8 attention.",http://arxiv.org/pdf/2407.08608v1,2024-07-11,2407.08608v1,FlashAttention-3: Fast and Accurate Attention with Asynchrony and Low-precision,gpt-4,highly irrelevant,"The paper focuses on attention mechanisms and improving efficiency in large language models, rather than on hard prefix prompting or prompt engineering techniques."
Turn-Level Empathy Prediction Using Psychological Indicators,"['Shaz Furniturewala', 'Kokil Jaidka']","For the WASSA 2024 Empathy and Personality Prediction Shared Task, we propose
a novel turn-level empathy detection method that decomposes empathy into six
psychological indicators: Emotional Language, Perspective-Taking, Sympathy and
Compassion, Extroversion, Openness, and Agreeableness. A pipeline of text
enrichment using a Large Language Model (LLM) followed by DeBERTA fine-tuning
demonstrates a significant improvement in the Pearson Correlation Coefficient
and F1 scores for empathy detection, highlighting the effectiveness of our
approach. Our system officially ranked 7th at the CONV-turn track.",http://arxiv.org/pdf/2407.08607v1,2024-07-11,2407.08607v1,Turn-Level Empathy Prediction Using Psychological Indicators,gpt-4,highly irrelevant,"The paper discusses using a Large Language Model for enriching text, but it doesn't mention prompts or prompt engineering, and the focus is more on empathy detection which is a different field."
A Review of Nine Physics Engines for Reinforcement Learning Research,"['Michael Kaup', 'Cornelius Wolff', 'Hyerim Hwang', 'Julius Mayer', 'Elia Bruni']","We present a review of popular simulation engines and frameworks used in
reinforcement learning (RL) research, aiming to guide researchers in selecting
tools for creating simulated physical environments for RL and training setups.
It evaluates nine frameworks (Brax, Chrono, Gazebo, MuJoCo, ODE, PhysX,
PyBullet, Webots, and Unity) based on their popularity, feature range, quality,
usability, and RL capabilities. We highlight the challenges in selecting and
utilizing physics engines for RL research, including the need for detailed
comparisons and an understanding of each framework's capabilities. Key findings
indicate MuJoCo as the leading framework due to its performance and
flexibility, despite usability challenges. Unity is noted for its ease of use
but lacks scalability and simulation fidelity. The study calls for further
development to improve simulation engines' usability and performance and
stresses the importance of transparency and reproducibility in RL research.
This review contributes to the RL community by offering insights into the
selection process for simulation engines, facilitating informed
decision-making.",http://arxiv.org/pdf/2407.08590v1,2024-07-11,2407.08590v1,A Review of Nine Physics Engines for Reinforcement Learning Research,gpt-4,highly irrelevant,The paper focuses on reviewing physics engines for reinforcement learning research and does not mention or discuss hard prefix prompting or prompt engineering.
HACMan++: Spatially-Grounded Motion Primitives for Manipulation,"['Bowen Jiang', 'Yilin Wu', 'Wenxuan Zhou', 'Chris Paxton', 'David Held']","Although end-to-end robot learning has shown some success for robot
manipulation, the learned policies are often not sufficiently robust to
variations in object pose or geometry. To improve the policy generalization, we
introduce spatially-grounded parameterized motion primitives in our method
HACMan++. Specifically, we propose an action representation consisting of three
components: what primitive type (such as grasp or push) to execute, where the
primitive will be grounded (e.g. where the gripper will make contact with the
world), and how the primitive motion is executed, such as parameters specifying
the push direction or grasp orientation. These three components define a novel
discrete-continuous action space for reinforcement learning. Our framework
enables robot agents to learn to chain diverse motion primitives together and
select appropriate primitive parameters to complete long-horizon manipulation
tasks. By grounding the primitives on a spatial location in the environment,
our method is able to effectively generalize across object shape and pose
variations. Our approach significantly outperforms existing methods,
particularly in complex scenarios demanding both high-level sequential
reasoning and object generalization. With zero-shot sim-to-real transfer, our
policy succeeds in challenging real-world manipulation tasks, with
generalization to unseen objects. Videos can be found on the project website:
https://sgmp-rss2024.github.io.",http://arxiv.org/pdf/2407.08585v1,2024-07-11,2407.08585v1,HACMan++: Spatially-Grounded Motion Primitives for Manipulation,gpt-4,highly irrelevant,"The paper mainly focuses on the creation of a spatially-grounded parameterized motion primitives for robot manipulation, rather than hard prefix prompting or prompt engineering."
