title,authors,abstract,pdf_url,published,arxiv_id,Title,Model,Rating,Reasoning
Lynx: An Open Source Hallucination Evaluation Model,"['Selvan Sunitha Ravi', 'Bartosz Mielczarek', 'Anand Kannappan', 'Douwe Kiela', 'Rebecca Qian']","Retrieval Augmented Generation (RAG) techniques aim to mitigate
hallucinations in Large Language Models (LLMs). However, LLMs can still produce
information that is unsupported or contradictory to the retrieved contexts. We
introduce LYNX, a SOTA hallucination detection LLM that is capable of advanced
reasoning on challenging real-world hallucination scenarios. To evaluate LYNX,
we present HaluBench, a comprehensive hallucination evaluation benchmark,
consisting of 15k samples sourced from various real-world domains. Our
experiment results show that LYNX outperforms GPT-4o, Claude-3-Sonnet, and
closed and open-source LLM-as-a-judge models on HaluBench. We release LYNX,
HaluBench and our evaluation code for public access.",http://arxiv.org/pdf/2407.08488v1,2024-07-11,2407.08488v1,Lynx: An Open Source Hallucination Evaluation Model,gpt-4,highly irrelevant,The paper primarily discusses mitigation of hallucinations in Large Language Models and introduces a hallucination detection model LYNX. It does not cover the topic of hard prefix prompting or prompt engineering.
Robust Generalization of Graph Neural Networks for Carrier Scheduling,"['Daniel F. Perez-Ramirez', 'Carlos Pérez-Penichet', 'Nicolas Tsiftes', 'Dejan Kostic', 'Magnus Boman', 'Thiemo Voigt']","Battery-free sensor tags are devices that leverage backscatter techniques to
communicate with standard IoT devices, thereby augmenting a network's sensing
capabilities in a scalable way. For communicating, a sensor tag relies on an
unmodulated carrier provided by a neighboring IoT device, with a schedule
coordinating this provisioning across the network. Carrier
scheduling--computing schedules to interrogate all sensor tags while minimizing
energy, spectrum utilization, and latency--is an NP-Hard optimization problem.
Recent work introduces learning-based schedulers that achieve resource savings
over a carefully-crafted heuristic, generalizing to networks of up to 60 nodes.
However, we find that their advantage diminishes in networks with hundreds of
nodes, and degrades further in larger setups. This paper introduces
RobustGANTT, a GNN-based scheduler that improves generalization (without
re-training) to networks up to 1000 nodes (100x training topology sizes).
RobustGANTT not only achieves better and more consistent generalization, but
also computes schedules requiring up to 2x less resources than existing
systems. Our scheduler exhibits average runtimes of hundreds of milliseconds,
allowing it to react fast to changing network conditions. Our work not only
improves resource utilization in large-scale backscatter networks, but also
offers valuable insights in learning-based scheduling.",http://arxiv.org/pdf/2407.08479v1,2024-07-11,2407.08479v1,Robust Generalization of Graph Neural Networks for Carrier Scheduling,gpt-4,highly irrelevant,The paper focuses on network scheduling and does not discuss any form of prompting or prompt engineering.
Investigating Public Fine-Tuning Datasets: A Complex Review of Current Practices from a Construction Perspective,"['Runyuan Ma', 'Wei Li', 'Fukai Shang']","With the rapid development of the large model domain, research related to
fine-tuning has concurrently seen significant advancement, given that
fine-tuning is a constituent part of the training process for large-scale
models. Data engineering plays a fundamental role in the training process of
models, which includes data infrastructure, data processing, etc. Data during
fine-tuning likewise forms the base for large models. In order to embrace the
power and explore new possibilities of fine-tuning datasets, this paper reviews
current public fine-tuning datasets from the perspective of data construction.
An overview of public fine-tuning datasets from two sides: evolution and
taxonomy, is provided in this review, aiming to chart the development
trajectory. Construction techniques and methods for public fine-tuning datasets
of Large Language Models (LLMs), including data generation and data
augmentation among others, are detailed. This elaboration follows the
aforementioned taxonomy, specifically across demonstration, comparison, and
generalist categories. Additionally, a category tree of data generation
techniques has been abstracted in our review to assist researchers in gaining a
deeper understanding of fine-tuning datasets from the construction dimension.
Our review also summarizes the construction features in different data
preparation phases of current practices in this field, aiming to provide a
comprehensive overview and inform future research. Fine-tuning dataset
practices, encompassing various data modalities, are also discussed from a
construction perspective in our review. Towards the end of the article, we
offer insights and considerations regarding the future construction and
developments of fine-tuning datasets.",http://arxiv.org/pdf/2407.08475v1,2024-07-11,2407.08475v1,Investigating Public Fine-Tuning Datasets: A Complex Review of Current Practices from a Construction Perspective,gpt-4,highly irrelevant,"This paper focuses on the review of public fine-tuning datasets from a construction perspective, detailing data engineering practices, data generation, and data augmentation techniques. However, there is no specific mention or implication of hard prefix prompting or prompt engineering."
Natural language is not enough: Benchmarking multi-modal generative AI for Verilog generation,"['Kaiyan Chang', 'Zhirong Chen', 'Yunhao Zhou', 'Wenlong Zhu', 'kun wang', 'Haobo Xu', 'Cangyuan Li', 'Mengdi Wang', 'Shengwen Liang', 'Huawei Li', 'Yinhe Han', 'Ying Wang']","Natural language interfaces have exhibited considerable potential in the
automation of Verilog generation derived from high-level specifications through
the utilization of large language models, garnering significant attention.
Nevertheless, this paper elucidates that visual representations contribute
essential contextual information critical to design intent for hardware
architectures possessing spatial complexity, potentially surpassing the
efficacy of natural-language-only inputs. Expanding upon this premise, our
paper introduces an open-source benchmark for multi-modal generative models
tailored for Verilog synthesis from visual-linguistic inputs, addressing both
singular and complex modules. Additionally, we introduce an open-source visual
and natural language Verilog query language framework to facilitate efficient
and user-friendly multi-modal queries. To evaluate the performance of the
proposed multi-modal hardware generative AI in Verilog generation tasks, we
compare it with a popular method that relies solely on natural language. Our
results demonstrate a significant accuracy improvement in the multi-modal
generated Verilog compared to queries based solely on natural language. We hope
to reveal a new approach to hardware design in the large-hardware-design-model
era, thereby fostering a more diversified and productive approach to hardware
design.",http://arxiv.org/pdf/2407.08473v1,2024-07-11,2407.08473v1,Natural language is not enough: Benchmarking multi-modal generative AI for Verilog generation,gpt-4,highly irrelevant,The paper focuses on the use of multi-modal generative models for Verilog synthesis and not on the use of prompting or prompt engineering techniques.
Brain Tumor Segmentation in MRI Images with 3D U-Net and Contextual Transformer,"['Thien-Qua T. Nguyen', 'Hieu-Nghia Nguyen', 'Thanh-Hieu Bui', 'Thien B. Nguyen-Tat', 'Vuong M. Ngo']","This research presents an enhanced approach for precise segmentation of brain
tumor masses in magnetic resonance imaging (MRI) using an advanced 3D-UNet
model combined with a Context Transformer (CoT). By architectural expansion
CoT, the proposed model extends its architecture to a 3D format, integrates it
smoothly with the base model to utilize the complex contextual information
found in MRI scans, emphasizing how elements rely on each other across an
extended spatial range. The proposed model synchronizes tumor mass
characteristics from CoT, mutually reinforcing feature extraction, facilitating
the precise capture of detailed tumor mass structures, including location,
size, and boundaries. Several experimental results present the outstanding
segmentation performance of the proposed method in comparison to current
state-of-the-art approaches, achieving Dice score of 82.0%, 81.5%, 89.0% for
Enhancing Tumor, Tumor Core and Whole Tumor, respectively, on BraTS2019.",http://arxiv.org/pdf/2407.08470v1,2024-07-11,2407.08470v1,Brain Tumor Segmentation in MRI Images with 3D U-Net and Contextual Transformer,gpt-4,highly irrelevant,"This paper primarily focuses on the application of 3D-UNet model and Contextual Transformer (CoT) for the segmentation of brain tumor masses from MRI images, with no mention or relevance to hard prefix prompting or prompt engineering in any context."
TLDR: Unsupervised Goal-Conditioned RL via Temporal Distance-Aware Representations,"['Junik Bae', 'Kwanyoung Park', 'Youngwoon Lee']","Unsupervised goal-conditioned reinforcement learning (GCRL) is a promising
paradigm for developing diverse robotic skills without external supervision.
However, existing unsupervised GCRL methods often struggle to cover a wide
range of states in complex environments due to their limited exploration and
sparse or noisy rewards for GCRL. To overcome these challenges, we propose a
novel unsupervised GCRL method that leverages TemporaL Distance-aware
Representations (TLDR). TLDR selects faraway goals to initiate exploration and
computes intrinsic exploration rewards and goal-reaching rewards, based on
temporal distance. Specifically, our exploration policy seeks states with large
temporal distances (i.e. covering a large state space), while the
goal-conditioned policy learns to minimize the temporal distance to the goal
(i.e. reaching the goal). Our experimental results in six simulated robotic
locomotion environments demonstrate that our method significantly outperforms
previous unsupervised GCRL methods in achieving a wide variety of states.",http://arxiv.org/pdf/2407.08464v1,2024-07-11,2407.08464v1,TLDR: Unsupervised Goal-Conditioned RL via Temporal Distance-Aware Representations,gpt-4,highly irrelevant,"This paper focuses on unsupervised goal-conditioned reinforcement learning, specifically for robotic locomotion environments, and does not discuss hard prefix prompting or prompt engineering."
Model Tells You Where to Merge: Adaptive KV Cache Merging for LLMs on Long-Context Tasks,"['Zheng Wang', 'Boxiao Jin', 'Zhongzhi Yu', 'Minjia Zhang']","How to efficiently serve Large Language Models (LLMs) has become a pressing
issue because of their huge computational cost in their autoregressive
generation process. To mitigate computational costs, LLMs often employ the KV
Cache technique to improve the generation speed. While improving the
computational efficiency, the storage requirements of the KV cache are
substantial, particularly in long-context scenarios, leading to significant
memory consumption. Existing KV cache eviction methods often degrade the
performance of LLMs in long-context scenarios due to the information loss
introduced by eviction. In this paper, we propose a novel KV cache merging
approach, called KVMerger, to achieve adaptive KV cache compression for
long-context tasks without significant performance degradation under
constrained memory budgets. Our approach is inspired by the intriguing
observation that key states exhibit high similarity at the token level within a
single sequence. To facilitate merging, we develop an effective yet
straightforward merging set identification algorithm to identify suitable KV
states for merging. Our merging set identification algorithm stimulates the
second observation that KV cache sparsity, from similarity perspective, is
independent of the dataset and remains persistent at the model level.
Subsequently, we propose a Gaussian kernel weighted merging algorithm to
selectively merge all states within each merging set. We conduct extensive
experiments to demonstrate the effectiveness of KVMerger for long-context tasks
under constrained memory budgets, applying it to models including
Llama2-7B-chat and Llama2-13B-chat. Using the LongBench and ZeroScroll
benchmarks, we compare our method with other KV cache compression techniques,
including H2O and CaM, showing that our method achieves superior performance
across tasks with both 50% and 35% KV cache budgets.",http://arxiv.org/pdf/2407.08454v1,2024-07-11,2407.08454v1,Model Tells You Where to Merge: Adaptive KV Cache Merging for LLMs on Long-Context Tasks,gpt-4,highly irrelevant,"The paper is mainly focused on the computational costs and efficiency of Large Language Models (LLMs), specifically improving the performance of the KV cache for long-context tasks. It does not seem to mention prompts or prompt engineering at all."
Paving the way toward foundation models for irregular and unaligned Satellite Image Time Series,"['Iris Dumeur', 'Silvia Valero', 'Jordi Inglada']","Although recently several foundation models for satellite remote sensing
imagery have been proposed, they fail to address major challenges of
real/operational applications. Indeed, embeddings that don't take into account
the spectral, spatial and temporal dimensions of the data as well as the
irregular or unaligned temporal sampling are of little use for most real world
uses.As a consequence, we propose an ALIgned Sits Encoder (ALISE), a novel
approach that leverages the spatial, spectral, and temporal dimensions of
irregular and unaligned SITS while producing aligned latent representations.
Unlike SSL models currently available for SITS, ALISE incorporates a flexible
query mechanism to project the SITS into a common and learned temporal
projection space. Additionally, thanks to a multi-view framework, we explore
integration of instance discrimination along a masked autoencoding task to
SITS. The quality of the produced representation is assessed through three
downstream tasks: crop segmentation (PASTIS), land cover segmentation
(MultiSenGE), and a novel crop change detection dataset. Furthermore, the
change detection task is performed without supervision. The results suggest
that the use of aligned representations is more effective than previous SSL
methods for linear probing segmentation tasks.",http://arxiv.org/pdf/2407.08448v1,2024-07-11,2407.08448v1,Paving the way toward foundation models for irregular and unaligned Satellite Image Time Series,gpt-4,highly irrelevant,This paper is focused on foundation models for satellite remote sensing imagery and does not mention or imply anything related to prompt engineering or hard prefix prompting.
How Deep is your Guess? A Fresh Perspective on Deep Learning for Medical Time-Series Imputation,"['Linglong Qian', 'Tao Wang', 'Jun Wang', 'Hugh Logan Ellis', 'Robin Mitra', 'Richard Dobson', 'Zina Ibrahim']","We introduce a novel classification framework for time-series imputation
using deep learning, with a particular focus on clinical data. By identifying
conceptual gaps in the literature and existing reviews, we devise a taxonomy
grounded on the inductive bias of neural imputation frameworks, resulting in a
classification of existing deep imputation strategies based on their
suitability for specific imputation scenarios and data-specific properties. Our
review further examines the existing methodologies employed to benchmark deep
imputation models, evaluating their effectiveness in capturing the missingness
scenarios found in clinical data and emphasising the importance of reconciling
mathematical abstraction with clinical insights. Our classification aims to
serve as a guide for researchers to facilitate the selection of appropriate
deep learning imputation techniques tailored to their specific clinical data.
Our novel perspective also highlights the significance of bridging the gap
between computational methodologies and medical insights to achieve clinically
sound imputation models.",http://arxiv.org/pdf/2407.08442v1,2024-07-11,2407.08442v1,How Deep is your Guess? A Fresh Perspective on Deep Learning for Medical Time-Series Imputation,gpt-4,highly irrelevant,This paper focuses on deep learning for time-series imputation in medical data and does not mention anything regarding hard prefix prompting or prompt engineering.
